{
  "allowed_artifact_versions": [
    "howedo.adapter-conformance-artifact.v1"
  ],
  "allowed_identity_patterns": [
    "https://github.com/eimyroot/HOWEDO/.github/workflows/consolidation.yml@refs/pull/*/merge"
  ],
  "allowed_issuers": [
    "https://token.actions.githubusercontent.com"
  ],
  "allowed_predicate_types": [
    "https://github.com/nulleimy/HOWEDO/attestations/adapter-conformance/v1"
  ],
  "allowed_ref_patterns": [
    "refs/pull/*/merge"
  ],
  "allowed_repositories": [
    "eimyroot/HOWEDO"
  ],
  "allowed_triggers": [
    "pull_request"
  ],
  "allowed_verifiers": [
    "sigstore-cosign"
  ],
  "allowed_workflows": [
    ".github/workflows/consolidation.yml"
  ],
  "policy_digest": "sha256:34e39721b8684e09dcdb9db969a90c3cb0f1a5ab6425641e967ec9ea5139760e",
  "policy_id": "https://github.com/eimyroot/HOWEDO/policies/test/github-actions-pr-conformance-trust-v1",
  "policy_version": "howedo.attestation-trust-policy.v1",
  "require_conformant_status": true,
  "require_execution_sha_matches_artifact_checkout": true,
  "require_transparency_log": true
}
