{
  "allowed_artifact_versions": [
    "howedo.adapter-conformance-artifact.v1"
  ],
  "allowed_identity_patterns": [
    "https://github.com/eimyroot/HOWEDO/.github/workflows/consolidation.yml@refs/heads/main"
  ],
  "allowed_issuers": [
    "https://token.actions.githubusercontent.com"
  ],
  "allowed_predicate_types": [
    "https://github.com/nulleimy/HOWEDO/attestations/adapter-conformance/v1"
  ],
  "allowed_ref_patterns": [
    "refs/heads/main"
  ],
  "allowed_repositories": [
    "eimyroot/HOWEDO"
  ],
  "allowed_triggers": [
    "push",
    "workflow_dispatch"
  ],
  "allowed_verifiers": [
    "sigstore-cosign"
  ],
  "allowed_workflows": [
    ".github/workflows/consolidation.yml"
  ],
  "policy_digest": "sha256:5a757c5ed7de3f78adc5fcc7127a254342246d0ebcaeaff14dfe6c4c6dc9432f",
  "policy_id": "https://github.com/eimyroot/HOWEDO/policies/reference/github-actions-conformance-trust-v1",
  "policy_version": "howedo.attestation-trust-policy.v1",
  "require_conformant_status": true,
  "require_execution_sha_matches_artifact_checkout": true,
  "require_transparency_log": true
}
